
Bus 002 Device 006: ID 148f:3070 Ralink Technology, Corp. RT2870/RT3070 Wireless Adapter
Device Descriptor:
  bLength                18
  bDescriptorType         1
  bcdUSB               2.00
  bDeviceClass            0 
  bDeviceSubClass         0 
  bDeviceProtocol         0 
  bMaxPacketSize0        64
  idVendor           0x148f Ralink Technology, Corp.
  idProduct          0x3070 RT2870/RT3070 Wireless Adapter
  bcdDevice            1.01
  iManufacturer           1 Ralink
  iProduct                2 802.11 n WLAN
  iSerial                 3 1.0
  bNumConfigurations      1
  Configuration Descriptor:
    bLength                 9
    bDescriptorType         2
    wTotalLength           67
    bNumInterfaces          1
    bConfigurationValue     1
    iConfiguration          0 
    bmAttributes         0x80
      (Bus Powered)
    MaxPower              450mA
    Interface Descriptor:
      bLength                 9
      bDescriptorType         4
      bInterfaceNumber        0
      bAlternateSetting       0
      bNumEndpoints           7
      bInterfaceClass       255 Vendor Specific Class
      bInterfaceSubClass    255 Vendor Specific Subclass
      bInterfaceProtocol    255 Vendor Specific Protocol
      iInterface              5 1.0
      Endpoint Descriptor:
        bLength                 7
        bDescriptorType         5
        bEndpointAddress     0x81  EP 1 IN
        bmAttributes            2
          Transfer Type            Bulk
          Synch Type               None
          Usage Type               Data
        wMaxPacketSize     0x0200  1x 512 bytes
        bInterval               0
      Endpoint Descriptor:
        bLength                 7
        bDescriptorType         5
        bEndpointAddress     0x01  EP 1 OUT
        bmAttributes            2
          Transfer Type            Bulk
          Synch Type               None
          Usage Type               Data
        wMaxPacketSize     0x0200  1x 512 bytes
        bInterval               0
      Endpoint Descriptor:
        bLength                 7
        bDescriptorType         5
        bEndpointAddress     0x02  EP 2 OUT
        bmAttributes            2
          Transfer Type            Bulk
          Synch Type               None
          Usage Type               Data
        wMaxPacketSize     0x0200  1x 512 bytes
        bInterval               0
      Endpoint Descriptor:
        bLength                 7
        bDescriptorType         5
        bEndpointAddress     0x03  EP 3 OUT
        bmAttributes            2
          Transfer Type            Bulk
          Synch Type               None
          Usage Type               Data
        wMaxPacketSize     0x0200  1x 512 bytes
        bInterval               0
      Endpoint Descriptor:
        bLength                 7
        bDescriptorType         5
        bEndpointAddress     0x04  EP 4 OUT
        bmAttributes            2
          Transfer Type            Bulk
          Synch Type               None
          Usage Type               Data
        wMaxPacketSize     0x0200  1x 512 bytes
        bInterval               0
      Endpoint Descriptor:
        bLength                 7
        bDescriptorType         5
        bEndpointAddress     0x05  EP 5 OUT
        bmAttributes            2
          Transfer Type            Bulk
          Synch Type               None
          Usage Type               Data
        wMaxPacketSize     0x0200  1x 512 bytes
        bInterval               0
      Endpoint Descriptor:
        bLength                 7
        bDescriptorType         5
        bEndpointAddress     0x06  EP 6 OUT
        bmAttributes            2
          Transfer Type            Bulk
          Synch Type               None
          Usage Type               Data
        wMaxPacketSize     0x0200  1x 512 bytes
        bInterval               0
Device Qualifier (for other device speed):
  bLength                10
  bDescriptorType         6
  bcdUSB               2.00
  bDeviceClass            0 
  bDeviceSubClass         0 
  bDeviceProtocol         0 
  bMaxPacketSize0        64
  bNumConfigurations      1
Device Status:     0x0000
  (Bus Powered)

Bus 002 Device 005: ID 1a86:7523 QinHeng Electronics HL-340 USB-Serial adapter
Device Descriptor:
  bLength                18
  bDescriptorType         1
  bcdUSB               1.10
  bDeviceClass          255 Vendor Specific Class
  bDeviceSubClass         0 
  bDeviceProtocol         0 
  bMaxPacketSize0         8
  idVendor           0x1a86 QinHeng Electronics
  idProduct          0x7523 HL-340 USB-Serial adapter
  bcdDevice            2.63
  iManufacturer           0 
  iProduct                2 USB2.0-Serial
  iSerial                 0 
  bNumConfigurations      1
  Configuration Descriptor:
    bLength                 9
    bDescriptorType         2
    wTotalLength           39
    bNumInterfaces          1
    bConfigurationValue     1
    iConfiguration          0 
    bmAttributes         0x80
      (Bus Powered)
    MaxPower               98mA
    Interface Descriptor:
      bLength                 9
      bDescriptorType         4
      bInterfaceNumber        0
      bAlternateSetting       0
      bNumEndpoints           3
      bInterfaceClass       255 Vendor Specific Class
      bInterfaceSubClass      1 
      bInterfaceProtocol      2 
      iInterface              0 
      Endpoint Descriptor:
        bLength                 7
        bDescriptorType         5
        bEndpointAddress     0x82  EP 2 IN
        bmAttributes            2
          Transfer Type            Bulk
          Synch Type               None
          Usage Type               Data
        wMaxPacketSize     0x0020  1x 32 bytes
        bInterval               0
      Endpoint Descriptor:
        bLength                 7
        bDescriptorType         5
        bEndpointAddress     0x02  EP 2 OUT
        bmAttributes            2
          Transfer Type            Bulk
          Synch Type               None
          Usage Type               Data
        wMaxPacketSize     0x0020  1x 32 bytes
        bInterval               0
      Endpoint Descriptor:
        bLength                 7
        bDescriptorType         5
        bEndpointAddress     0x81  EP 1 IN
        bmAttributes            3
          Transfer Type            Interrupt
          Synch Type               None
          Usage Type               Data
        wMaxPacketSize     0x0008  1x 8 bytes
        bInterval               1
Device Status:     0x0000
  (Bus Powered)

Bus 002 Device 002: ID 8087:0020 Intel Corp. Integrated Rate Matching Hub
Device Descriptor:
  bLength                18
  bDescriptorType         1
  bcdUSB               2.00
  bDeviceClass            9 Hub
  bDeviceSubClass         0 
  bDeviceProtocol         1 Single TT
  bMaxPacketSize0        64
  idVendor           0x8087 Intel Corp.
  idProduct          0x0020 Integrated Rate Matching Hub
  bcdDevice            0.00
  iManufacturer           0 
  iProduct                0 
  iSerial                 0 
  bNumConfigurations      1
  Configuration Descriptor:
    bLength                 9
    bDescriptorType         2
    wTotalLength           25
    bNumInterfaces          1
    bConfigurationValue     1
    iConfiguration          0 
    bmAttributes         0xe0
      Self Powered
      Remote Wakeup
    MaxPower                0mA
    Interface Descriptor:
      bLength                 9
      bDescriptorType         4
      bInterfaceNumber        0
      bAlternateSetting       0
      bNumEndpoints           1
      bInterfaceClass         9 Hub
      bInterfaceSubClass      0 
      bInterfaceProtocol      0 Full speed (or root) hub
      iInterface              0 
      Endpoint Descriptor:
        bLength                 7
        bDescriptorType         5
        bEndpointAddress     0x81  EP 1 IN
        bmAttributes            3
          Transfer Type            Interrupt
          Synch Type               None
          Usage Type               Data
        wMaxPacketSize     0x0002  1x 2 bytes
        bInterval              12
Hub Descriptor:
  bLength              11
  bDescriptorType      41
  nNbrPorts             6
  wHubCharacteristic 0x0089
    Per-port power switching
    Per-port overcurrent protection
    TT think time 8 FS bits
    Port indicators
  bPwrOn2PwrGood       50 * 2 milli seconds
  bHubContrCurrent      0 milli Ampere
  DeviceRemovable    0x00
  PortPwrCtrlMask    0xff
 Hub Port Status:
   Port 1: 0000.0100 power
   Port 2: 0000.0100 power
   Port 3: 0000.0103 power enable connect
   Port 4: 0000.0503 highspeed power enable connect
   Port 5: 0000.0100 power
   Port 6: 0000.0100 power
Device Qualifier (for other device speed):
  bLength                10
  bDescriptorType         6
  bcdUSB               2.00
  bDeviceClass            9 Hub
  bDeviceSubClass         0 
  bDeviceProtocol         0 Full speed (or root) hub
  bMaxPacketSize0        64
  bNumConfigurations      1
Device Status:     0x0001
  Self Powered

Bus 002 Device 001: ID 1d6b:0002 Linux Foundation 2.0 root hub
Device Descriptor:
  bLength                18
  bDescriptorType         1
  bcdUSB               2.00
  bDeviceClass            9 Hub
  bDeviceSubClass         0 
  bDeviceProtocol         0 Full speed (or root) hub
  bMaxPacketSize0        64
  idVendor           0x1d6b Linux Foundation
  idProduct          0x0002 2.0 root hub
  bcdDevice            4.15
  iManufacturer           3 Linux 4.15.5-1-ARCH ehci_hcd
  iProduct                2 EHCI Host Controller
  iSerial                 1 0000:00:1d.0
  bNumConfigurations      1
  Configuration Descriptor:
    bLength                 9
    bDescriptorType         2
    wTotalLength           25
    bNumInterfaces          1
    bConfigurationValue     1
    iConfiguration          0 
    bmAttributes         0xe0
      Self Powered
      Remote Wakeup
    MaxPower                0mA
    Interface Descriptor:
      bLength                 9
      bDescriptorType         4
      bInterfaceNumber        0
      bAlternateSetting       0
      bNumEndpoints           1
      bInterfaceClass         9 Hub
      bInterfaceSubClass      0 
      bInterfaceProtocol      0 Full speed (or root) hub
      iInterface              0 
      Endpoint Descriptor:
        bLength                 7
        bDescriptorType         5
        bEndpointAddress     0x81  EP 1 IN
        bmAttributes            3
          Transfer Type            Interrupt
          Synch Type               None
          Usage Type               Data
        wMaxPacketSize     0x0004  1x 4 bytes
        bInterval              12
Hub Descriptor:
  bLength               9
  bDescriptorType      41
  nNbrPorts             2
  wHubCharacteristic 0x000a
    No power switching (usb 1.0)
    Per-port overcurrent protection
  bPwrOn2PwrGood       10 * 2 milli seconds
  bHubContrCurrent      0 milli Ampere
  DeviceRemovable    0x02
  PortPwrCtrlMask    0xff
 Hub Port Status:
   Port 1: 0000.0503 highspeed power enable connect
   Port 2: 0000.0100 power
Device Status:     0x0001
  Self Powered

Bus 001 Device 006: ID 1532:0216 Razer USA, Ltd BlackWidow X Chroma
Device Descriptor:
  bLength                18
  bDescriptorType         1
  bcdUSB               2.00
  bDeviceClass            0 
  bDeviceSubClass         0 
  bDeviceProtocol         0 
  bMaxPacketSize0        64
  idVendor           0x1532 Razer USA, Ltd
  idProduct          0x0216 BlackWidow X Chroma
  bcdDevice            2.00
  iManufacturer           1 Razer
  iProduct                2 Razer BlackWidow X Chroma
  iSerial                 0 
  bNumConfigurations      1
  Configuration Descriptor:
    bLength                 9
    bDescriptorType         2
    wTotalLength           84
    bNumInterfaces          3
    bConfigurationValue     1
    iConfiguration          0 
    bmAttributes         0xa0
      (Bus Powered)
      Remote Wakeup
    MaxPower              500mA
    Interface Descriptor:
      bLength                 9
      bDescriptorType         4
      bInterfaceNumber        0
      bAlternateSetting       0
      bNumEndpoints           1
      bInterfaceClass         3 Human Interface Device
      bInterfaceSubClass      1 Boot Interface Subclass
      bInterfaceProtocol      1 Keyboard
      iInterface              0 
        HID Device Descriptor:
          bLength                 9
          bDescriptorType        33
          bcdHID               1.11
          bCountryCode            0 Not supported
          bNumDescriptors         1
          bDescriptorType        34 Report
          wDescriptorLength      61
         Report Descriptors: 
           ** UNAVAILABLE **
      Endpoint Descriptor:
        bLength                 7
        bDescriptorType         5
        bEndpointAddress     0x81  EP 1 IN
        bmAttributes            3
          Transfer Type            Interrupt
          Synch Type               None
          Usage Type               Data
        wMaxPacketSize     0x0008  1x 8 bytes
        bInterval               1
    Interface Descriptor:
      bLength                 9
      bDescriptorType         4
      bInterfaceNumber        1
      bAlternateSetting       0
      bNumEndpoints           1
      bInterfaceClass         3 Human Interface Device
      bInterfaceSubClass      0 
      bInterfaceProtocol      1 Keyboard
      iInterface              0 
        HID Device Descriptor:
          bLength                 9
          bDescriptorType        33
          bcdHID               1.11
          bCountryCode            0 Not supported
          bNumDescriptors         1
          bDescriptorType        34 Report
          wDescriptorLength     159
         Report Descriptors: 
           ** UNAVAILABLE **
      Endpoint Descriptor:
        bLength                 7
        bDescriptorType         5
        bEndpointAddress     0x82  EP 2 IN
        bmAttributes            3
          Transfer Type            Interrupt
          Synch Type               None
          Usage Type               Data
        wMaxPacketSize     0x0010  1x 16 bytes
        bInterval               1
    Interface Descriptor:
      bLength                 9
      bDescriptorType         4
      bInterfaceNumber        2
      bAlternateSetting       0
      bNumEndpoints           1
      bInterfaceClass         3 Human Interface Device
      bInterfaceSubClass      0 
      bInterfaceProtocol      2 Mouse
      iInterface              0 
        HID Device Descriptor:
          bLength                 9
          bDescriptorType        33
          bcdHID               1.11
          bCountryCode            0 Not supported
          bNumDescriptors         1
          bDescriptorType        34 Report
          wDescriptorLength      94
         Report Descriptors: 
           ** UNAVAILABLE **
      Endpoint Descriptor:
        bLength                 7
        bDescriptorType         5
        bEndpointAddress     0x83  EP 3 IN
        bmAttributes            3
          Transfer Type            Interrupt
          Synch Type               None
          Usage Type               Data
        wMaxPacketSize     0x0008  1x 8 bytes
        bInterval               1
Device Status:     0x0000
  (Bus Powered)

Bus 001 Device 005: ID 0d8c:000c C-Media Electronics, Inc. Audio Adapter
Device Descriptor:
  bLength                18
  bDescriptorType         1
  bcdUSB               1.10
  bDeviceClass            0 
  bDeviceSubClass         0 
  bDeviceProtocol         0 
  bMaxPacketSize0        64
  idVendor           0x0d8c C-Media Electronics, Inc.
  idProduct          0x000c Audio Adapter
  bcdDevice            1.00
  iManufacturer           0 
  iProduct                1 C-Media USB Headphone Set  
  iSerial                 0 
  bNumConfigurations      1
  Configuration Descriptor:
    bLength                 9
    bDescriptorType         2
    wTotalLength          224
    bNumInterfaces          4
    bConfigurationValue     1
    iConfiguration          0 
    bmAttributes         0xa0
      (Bus Powered)
      Remote Wakeup
    MaxPower              100mA
    Interface Descriptor:
      bLength                 9
      bDescriptorType         4
      bInterfaceNumber        0
      bAlternateSetting       0
      bNumEndpoints           0
      bInterfaceClass         1 Audio
      bInterfaceSubClass      1 Control Device
      bInterfaceProtocol      0 
      iInterface              0 
      AudioControl Interface Descriptor:
        bLength                10
        bDescriptorType        36
        bDescriptorSubtype      1 (HEADER)
        bcdADC               1.00
        wTotalLength           71
        bInCollection           2
        baInterfaceNr( 0)       1
        baInterfaceNr( 1)       2
      AudioControl Interface Descriptor:
        bLength                12
        bDescriptorType        36
        bDescriptorSubtype      2 (INPUT_TERMINAL)
        bTerminalID             1
        wTerminalType      0x0101 USB Streaming
        bAssocTerminal          0
        bNrChannels             2
        wChannelConfig     0x0003
          Left Front (L)
          Right Front (R)
        iChannelNames           0 
        iTerminal               0 
      AudioControl Interface Descriptor:
        bLength                12
        bDescriptorType        36
        bDescriptorSubtype      2 (INPUT_TERMINAL)
        bTerminalID             2
        wTerminalType      0x0201 Microphone
        bAssocTerminal          0
        bNrChannels             1
        wChannelConfig     0x0001
          Left Front (L)
        iChannelNames           0 
        iTerminal               0 
      AudioControl Interface Descriptor:
        bLength                 9
        bDescriptorType        36
        bDescriptorSubtype      3 (OUTPUT_TERMINAL)
        bTerminalID             6
        wTerminalType      0x0301 Speaker
        bAssocTerminal          0
        bSourceID               9
        iTerminal               0 
      AudioControl Interface Descriptor:
        bLength                 9
        bDescriptorType        36
        bDescriptorSubtype      3 (OUTPUT_TERMINAL)
        bTerminalID             7
        wTerminalType      0x0101 USB Streaming
        bAssocTerminal          0
        bSourceID              10
        iTerminal               0 
      AudioControl Interface Descriptor:
        bLength                10
        bDescriptorType        36
        bDescriptorSubtype      6 (FEATURE_UNIT)
        bUnitID                 9
        bSourceID               1
        bControlSize            1
        bmaControls( 0)      0x01
          Mute Control
        bmaControls( 1)      0x02
          Volume Control
        bmaControls( 2)      0x02
          Volume Control
        iFeature                0 
      AudioControl Interface Descriptor:
        bLength                 9
        bDescriptorType        36
        bDescriptorSubtype      6 (FEATURE_UNIT)
        bUnitID                10
        bSourceID               2
        bControlSize            1
        bmaControls( 0)      0x43
          Mute Control
          Volume Control
          Automatic Gain Control
        bmaControls( 1)      0x00
        iFeature                0 
    Interface Descriptor:
      bLength                 9
      bDescriptorType         4
      bInterfaceNumber        1
      bAlternateSetting       0
      bNumEndpoints           0
      bInterfaceClass         1 Audio
      bInterfaceSubClass      2 Streaming
      bInterfaceProtocol      0 
      iInterface              0 
    Interface Descriptor:
      bLength                 9
      bDescriptorType         4
      bInterfaceNumber        1
      bAlternateSetting       1
      bNumEndpoints           1
      bInterfaceClass         1 Audio
      bInterfaceSubClass      2 Streaming
      bInterfaceProtocol      0 
      iInterface              0 
      AudioStreaming Interface Descriptor:
        bLength                 7
        bDescriptorType        36
        bDescriptorSubtype      1 (AS_GENERAL)
        bTerminalLink           1
        bDelay                  1 frames
        wFormatTag              1 PCM
      AudioStreaming Interface Descriptor:
        bLength                14
        bDescriptorType        36
        bDescriptorSubtype      2 (FORMAT_TYPE)
        bFormatType             1 (FORMAT_TYPE_I)
        bNrChannels             2
        bSubframeSize           2
        bBitResolution         16
        bSamFreqType            2 Discrete
        tSamFreq[ 0]        48000
        tSamFreq[ 1]        44100
      Endpoint Descriptor:
        bLength                 9
        bDescriptorType         5
        bEndpointAddress     0x01  EP 1 OUT
        bmAttributes            9
          Transfer Type            Isochronous
          Synch Type               Adaptive
          Usage Type               Data
        wMaxPacketSize     0x00c8  1x 200 bytes
        bInterval               1
        bRefresh                0
        bSynchAddress           0
        AudioControl Endpoint Descriptor:
          bLength                 7
          bDescriptorType        37
          bDescriptorSubtype      1 (EP_GENERAL)
          bmAttributes         0x01
            Sampling Frequency
          bLockDelayUnits         1 Milliseconds
          wLockDelay              1 Milliseconds
    Interface Descriptor:
      bLength                 9
      bDescriptorType         4
      bInterfaceNumber        2
      bAlternateSetting       0
      bNumEndpoints           0
      bInterfaceClass         1 Audio
      bInterfaceSubClass      2 Streaming
      bInterfaceProtocol      0 
      iInterface              0 
    Interface Descriptor:
      bLength                 9
      bDescriptorType         4
      bInterfaceNumber        2
      bAlternateSetting       1
      bNumEndpoints           1
      bInterfaceClass         1 Audio
      bInterfaceSubClass      2 Streaming
      bInterfaceProtocol      0 
      iInterface              0 
      AudioStreaming Interface Descriptor:
        bLength                 7
        bDescriptorType        36
        bDescriptorSubtype      1 (AS_GENERAL)
        bTerminalLink           7
        bDelay                  1 frames
        wFormatTag              1 PCM
      AudioStreaming Interface Descriptor:
        bLength                14
        bDescriptorType        36
        bDescriptorSubtype      2 (FORMAT_TYPE)
        bFormatType             1 (FORMAT_TYPE_I)
        bNrChannels             1
        bSubframeSize           2
        bBitResolution         16
        bSamFreqType            2 Discrete
        tSamFreq[ 0]        48000
        tSamFreq[ 1]        44100
      Endpoint Descriptor:
        bLength                 9
        bDescriptorType         5
        bEndpointAddress     0x82  EP 2 IN
        bmAttributes            5
          Transfer Type            Isochronous
          Synch Type               Asynchronous
          Usage Type               Data
        wMaxPacketSize     0x0064  1x 100 bytes
        bInterval               1
        bRefresh                0
        bSynchAddress           0
        AudioControl Endpoint Descriptor:
          bLength                 7
          bDescriptorType        37
          bDescriptorSubtype      1 (EP_GENERAL)
          bmAttributes         0x01
            Sampling Frequency
          bLockDelayUnits         0 Undefined
          wLockDelay              0 Undefined
    Interface Descriptor:
      bLength                 9
      bDescriptorType         4
      bInterfaceNumber        3
      bAlternateSetting       0
      bNumEndpoints           1
      bInterfaceClass         3 Human Interface Device
      bInterfaceSubClass      0 
      bInterfaceProtocol      0 
      iInterface              0 
        HID Device Descriptor:
          bLength                 9
          bDescriptorType        33
          bcdHID               1.00
          bCountryCode            0 Not supported
          bNumDescriptors         1
          bDescriptorType        34 Report
          wDescriptorLength      50
         Report Descriptors: 
           ** UNAVAILABLE **
      Endpoint Descriptor:
        bLength                 7
        bDescriptorType         5
        bEndpointAddress     0x83  EP 3 IN
        bmAttributes            3
          Transfer Type            Interrupt
          Synch Type               None
          Usage Type               Data
        wMaxPacketSize     0x0004  1x 4 bytes
        bInterval              32
Device Status:     0x0000
  (Bus Powered)

Bus 001 Device 004: ID 1058:0704 Western Digital Technologies, Inc. My Passport Essential (WDME)
Device Descriptor:
  bLength                18
  bDescriptorType         1
  bcdUSB               2.00
  bDeviceClass            0 
  bDeviceSubClass         0 
  bDeviceProtocol         0 
  bMaxPacketSize0        64
  idVendor           0x1058 Western Digital Technologies, Inc.
  idProduct          0x0704 My Passport Essential (WDME)
  bcdDevice            1.05
  iManufacturer           1 Western Digital 
  iProduct                2 External HDD    
  iSerial                 3 57584E3930384E4530313138
  bNumConfigurations      1
  Configuration Descriptor:
    bLength                 9
    bDescriptorType         2
    wTotalLength           32
    bNumInterfaces          1
    bConfigurationValue     1
    iConfiguration          0 
    bmAttributes         0xc0
      Self Powered
    MaxPower                2mA
    Interface Descriptor:
      bLength                 9
      bDescriptorType         4
      bInterfaceNumber        0
      bAlternateSetting       0
      bNumEndpoints           2
      bInterfaceClass         8 Mass Storage
      bInterfaceSubClass      6 SCSI
      bInterfaceProtocol     80 Bulk-Only
      iInterface              0 
      Endpoint Descriptor:
        bLength                 7
        bDescriptorType         5
        bEndpointAddress     0x81  EP 1 IN
        bmAttributes            2
          Transfer Type            Bulk
          Synch Type               None
          Usage Type               Data
        wMaxPacketSize     0x0200  1x 512 bytes
        bInterval               0
      Endpoint Descriptor:
        bLength                 7
        bDescriptorType         5
        bEndpointAddress     0x02  EP 2 OUT
        bmAttributes            2
          Transfer Type            Bulk
          Synch Type               None
          Usage Type               Data
        wMaxPacketSize     0x0200  1x 512 bytes
        bInterval               0
Device Qualifier (for other device speed):
  bLength                10
  bDescriptorType         6
  bcdUSB               2.00
  bDeviceClass            0 
  bDeviceSubClass         0 
  bDeviceProtocol         0 
  bMaxPacketSize0        64
  bNumConfigurations      1
Device Status:     0x0001
  Self Powered

Bus 001 Device 003: ID 1ea7:1006 SHARKOON Technologies GmbH 
Device Descriptor:
  bLength                18
  bDescriptorType         1
  bcdUSB               1.10
  bDeviceClass            0 
  bDeviceSubClass         0 
  bDeviceProtocol         0 
  bMaxPacketSize0         8
  idVendor           0x1ea7 SHARKOON Technologies GmbH
  idProduct          0x1006 
  bcdDevice            1.04
  iManufacturer           1 BTL
  iProduct                2 Gaming Mouse
  iSerial                 0 
  bNumConfigurations      1
  Configuration Descriptor:
    bLength                 9
    bDescriptorType         2
    wTotalLength           59
    bNumInterfaces          2
    bConfigurationValue     1
    iConfiguration          0 
    bmAttributes         0xa0
      (Bus Powered)
      Remote Wakeup
    MaxPower              100mA
    Interface Descriptor:
      bLength                 9
      bDescriptorType         4
      bInterfaceNumber        0
      bAlternateSetting       0
      bNumEndpoints           1
      bInterfaceClass         3 Human Interface Device
      bInterfaceSubClass      1 Boot Interface Subclass
      bInterfaceProtocol      2 Mouse
      iInterface              0 
        HID Device Descriptor:
          bLength                 9
          bDescriptorType        33
          bcdHID               1.10
          bCountryCode            0 Not supported
          bNumDescriptors         1
          bDescriptorType        34 Report
          wDescriptorLength     199
         Report Descriptors: 
           ** UNAVAILABLE **
      Endpoint Descriptor:
        bLength                 7
        bDescriptorType         5
        bEndpointAddress     0x81  EP 1 IN
        bmAttributes            3
          Transfer Type            Interrupt
          Synch Type               None
          Usage Type               Data
        wMaxPacketSize     0x0008  1x 8 bytes
        bInterval               1
    Interface Descriptor:
      bLength                 9
      bDescriptorType         4
      bInterfaceNumber        1
      bAlternateSetting       0
      bNumEndpoints           1
      bInterfaceClass         3 Human Interface Device
      bInterfaceSubClass      0 
      bInterfaceProtocol      1 Keyboard
      iInterface              0 
        HID Device Descriptor:
          bLength                 9
          bDescriptorType        33
          bcdHID               1.11
          bCountryCode            0 Not supported
          bNumDescriptors         1
          bDescriptorType        34 Report
          wDescriptorLength      63
         Report Descriptors: 
           ** UNAVAILABLE **
      Endpoint Descriptor:
        bLength                 7
        bDescriptorType         5
        bEndpointAddress     0x82  EP 2 IN
        bmAttributes            3
          Transfer Type            Interrupt
          Synch Type               None
          Usage Type               Data
        wMaxPacketSize     0x0008  1x 8 bytes
        bInterval               1
Device Status:     0x0000
  (Bus Powered)

Bus 001 Device 002: ID 8087:0020 Intel Corp. Integrated Rate Matching Hub
Device Descriptor:
  bLength                18
  bDescriptorType         1
  bcdUSB               2.00
  bDeviceClass            9 Hub
  bDeviceSubClass         0 
  bDeviceProtocol         1 Single TT
  bMaxPacketSize0        64
  idVendor           0x8087 Intel Corp.
  idProduct          0x0020 Integrated Rate Matching Hub
  bcdDevice            0.00
  iManufacturer           0 
  iProduct                0 
  iSerial                 0 
  bNumConfigurations      1
  Configuration Descriptor:
    bLength                 9
    bDescriptorType         2
    wTotalLength           25
    bNumInterfaces          1
    bConfigurationValue     1
    iConfiguration          0 
    bmAttributes         0xe0
      Self Powered
      Remote Wakeup
    MaxPower                0mA
    Interface Descriptor:
      bLength                 9
      bDescriptorType         4
      bInterfaceNumber        0
      bAlternateSetting       0
      bNumEndpoints           1
      bInterfaceClass         9 Hub
      bInterfaceSubClass      0 
      bInterfaceProtocol      0 Full speed (or root) hub
      iInterface              0 
      Endpoint Descriptor:
        bLength                 7
        bDescriptorType         5
        bEndpointAddress     0x81  EP 1 IN
        bmAttributes            3
          Transfer Type            Interrupt
          Synch Type               None
          Usage Type               Data
        wMaxPacketSize     0x0001  1x 1 bytes
        bInterval              12
Hub Descriptor:
  bLength               9
  bDescriptorType      41
  nNbrPorts             6
  wHubCharacteristic 0x0089
    Per-port power switching
    Per-port overcurrent protection
    TT think time 8 FS bits
    Port indicators
  bPwrOn2PwrGood       50 * 2 milli seconds
  bHubContrCurrent      0 milli Ampere
  DeviceRemovable    0x00
  PortPwrCtrlMask    0xff
 Hub Port Status:
   Port 1: 0000.0103 power enable connect
   Port 2: 0000.0503 highspeed power enable connect
   Port 3: 0000.0100 power
   Port 4: 0000.0103 power enable connect
   Port 5: 0000.0100 power
   Port 6: 0000.0103 power enable connect
Device Qualifier (for other device speed):
  bLength                10
  bDescriptorType         6
  bcdUSB               2.00
  bDeviceClass            9 Hub
  bDeviceSubClass         0 
  bDeviceProtocol         0 Full speed (or root) hub
  bMaxPacketSize0        64
  bNumConfigurations      1
Device Status:     0x0001
  Self Powered

Bus 001 Device 001: ID 1d6b:0002 Linux Foundation 2.0 root hub
Device Descriptor:
  bLength                18
  bDescriptorType         1
  bcdUSB               2.00
  bDeviceClass            9 Hub
  bDeviceSubClass         0 
  bDeviceProtocol         0 Full speed (or root) hub
  bMaxPacketSize0        64
  idVendor           0x1d6b Linux Foundation
  idProduct          0x0002 2.0 root hub
  bcdDevice            4.15
  iManufacturer           3 Linux 4.15.5-1-ARCH ehci_hcd
  iProduct                2 EHCI Host Controller
  iSerial                 1 0000:00:1a.0
  bNumConfigurations      1
  Configuration Descriptor:
    bLength                 9
    bDescriptorType         2
    wTotalLength           25
    bNumInterfaces          1
    bConfigurationValue     1
    iConfiguration          0 
    bmAttributes         0xe0
      Self Powered
      Remote Wakeup
    MaxPower                0mA
    Interface Descriptor:
      bLength                 9
      bDescriptorType         4
      bInterfaceNumber        0
      bAlternateSetting       0
      bNumEndpoints           1
      bInterfaceClass         9 Hub
      bInterfaceSubClass      0 
      bInterfaceProtocol      0 Full speed (or root) hub
      iInterface              0 
      Endpoint Descriptor:
        bLength                 7
        bDescriptorType         5
        bEndpointAddress     0x81  EP 1 IN
        bmAttributes            3
          Transfer Type            Interrupt
          Synch Type               None
          Usage Type               Data
        wMaxPacketSize     0x0004  1x 4 bytes
        bInterval              12
Hub Descriptor:
  bLength               9
  bDescriptorType      41
  nNbrPorts             2
  wHubCharacteristic 0x000a
    No power switching (usb 1.0)
    Per-port overcurrent protection
  bPwrOn2PwrGood       10 * 2 milli seconds
  bHubContrCurrent      0 milli Ampere
  DeviceRemovable    0x02
  PortPwrCtrlMask    0xff
 Hub Port Status:
   Port 1: 0000.0503 highspeed power enable connect
   Port 2: 0000.0100 power
Device Status:     0x0001
  Self Powered
